{
  "$schema": "https://json-schema.org/draft/2020-12/schema",
  "$id": "urn:champions_sim:schema:regulation-rehearsal-input:1",
  "title": "SIM-02 Sealed Regulation Rehearsal Input",
  "type": "object",
  "additionalProperties": false,
  "required": [
    "schema_version", "report_id", "rehearsal_kind", "t0", "t_decision",
    "resources", "silent_fallback_count", "source_manifest_ids", "notes"
  ],
  "properties": {
    "schema_version": {"const": "1.0.0"},
    "report_id": {"$ref": "#/$defs/stableId"},
    "rehearsal_kind": {"const": "synthetic_internal"},
    "t0": {"type": "string", "minLength": 1},
    "t_decision": {"type": "string", "minLength": 1},
    "resources": {
      "type": "object", "additionalProperties": false,
      "required": [
        "measurement_status", "compute_environment", "process_count",
        "max_parallel_workers", "network_fetch_count", "execution_minutes",
        "manual_work_minutes", "external_wait_minutes"
      ],
      "properties": {
        "measurement_status": {"enum": ["measured", "synthetic_fixture"]},
        "compute_environment": {"type": "string", "minLength": 1},
        "process_count": {"type": "integer", "minimum": 1},
        "max_parallel_workers": {"type": "integer", "minimum": 1},
        "network_fetch_count": {"type": "integer", "minimum": 0},
        "execution_minutes": {"type": "integer", "minimum": 0},
        "manual_work_minutes": {"type": "integer", "minimum": 0},
        "external_wait_minutes": {"type": "integer", "minimum": 0}
      }
    },
    "silent_fallback_count": {"type": "integer", "minimum": 0},
    "source_manifest_ids": {
      "type": "array", "minItems": 1, "uniqueItems": true,
      "items": {"$ref": "#/$defs/stableId"}
    },
    "notes": {
      "type": "array", "minItems": 1,
      "items": {"type": "string", "minLength": 1}
    }
  },
  "$defs": {
    "stableId": {
      "type": "string", "minLength": 1, "maxLength": 240,
      "pattern": "^[A-Za-z0-9][A-Za-z0-9._:-]*$"
    }
  }
}
