{
  "schema_version": "1.0.0",
  "report_id": "sim02-synthetic-delta-rehearsal-20260713",
  "rehearsal_kind": "synthetic_internal",
  "t0": "2026-07-13T00:00:00+09:00",
  "t_decision": "2026-07-13T06:00:00+09:00",
  "resources": {
    "measurement_status": "synthetic_fixture",
    "compute_environment": "local-windows-python-3.10-single-process",
    "process_count": 1,
    "max_parallel_workers": 1,
    "network_fetch_count": 0,
    "execution_minutes": 15,
    "manual_work_minutes": 90,
    "external_wait_minutes": 0
  },
  "silent_fallback_count": 0,
  "source_manifest_ids": [
    "sim02-regulation-rehearsal-report"
  ],
  "notes": [
    "t0, t_decision, and resource values are sealed synthetic fixture inputs, not measurements of elapsed wall-clock work in this repository.",
    "Operational success means the pipeline emitted a reasoned NO-GO within the rehearsal SLA; it is not a deployable candidate success.",
    "No network acquisition or external wait is simulated in this fixture."
  ]
}
